{
  "race_id": "519866",
  "date": "2025-03-15",
  "region": "gb",
  "course": "Cheltenham",
  "course_id": "133297",
  "off": "example-value",
  "off_dt": "",
  "race_name": "Example Name",
  "type": "flat",
  "class": "class_1",
  "pattern": "example-value",
  "rating_band": "example-value",
  "age_band": "example-value",
  "sex_rest": "example-value",
  "dist": "example-value",
  "dist_y": "example-value",
  "dist_m": "example-value",
  "dist_f": "example-value",
  "going": "good",
  "surface": "",
  "jumps": "",
  "runners": [
    "example-value"
  ],
  "winning_time_detail": "",
  "comments": "",
  "non_runners": "",
  "tote_win": "",
  "tote_pl": "",
  "tote_ex": "",
  "tote_csf": "",
  "tote_tricast": "",
  "tote_trifecta": ""
}